Sheet: strings
A1: id | B1: 等级 | C1: 升到下一级所需经验 | D1: 升到本级所需的总经验
A2: uint|ID | B2: ushort|Level | C2: uint|NextLevelNeedExp | D2: uint|CurrentLevelNeedExp
A3: both | B3: both | C3: both | D3: both
A4: 1 | B4: 1 | C4: 100 | D4: 0
A5: 2 | B5: 2 | C5: 200 | D5: =R[-1]C[-1]+R[-1]C -> 100
A6: 3 | B6: 3 | C6: 300 | D6: =R[-1]C[-1]+R[-1]C -> 300
A7: 4 | B7: 4 | C7: 400 | D7: =R[-1]C[-1]+R[-1]C -> 600
A8: 5 | B8: 5 | C8: 500 | D8: =R[-1]C[-1]+R[-1]C -> 1000
A9: 6 | B9: 6 | C9: 600 | D9: =R[-1]C[-1]+R[-1]C -> 1500
A10: 7 | B10: 7 | C10: 700 | D10: =R[-1]C[-1]+R[-1]C -> 2100
A11: 8 | B11: 8 | C11: 800 | D11: =R[-1]C[-1]+R[-1]C -> 2800
A12: 9 | B12: 9 | C12: 900 | D12: =R[-1]C[-1]+R[-1]C -> 3600
A13: 10 | B13: 10 | C13: 1000 | D13: =R[-1]C[-1]+R[-1]C -> 4500
A14: 11 | B14: 11 | C14: 1100 | D14: =R[-1]C[-1]+R[-1]C -> 5500
A15: 12 | B15: 12 | C15: 1200 | D15: =R[-1]C[-1]+R[-1]C -> 6600
A16: 13 | B16: 13 | C16: 1300 | D16: =R[-1]C[-1]+R[-1]C -> 7800
A17: 14 | B17: 14 | C17: 1400 | D17: =R[-1]C[-1]+R[-1]C -> 9100
A18: 15 | B18: 15 | C18: 1500 | D18: =R[-1]C[-1]+R[-1]C -> 10500
A19: 16 | B19: 16 | C19: 1600 | D19: =R[-1]C[-1]+R[-1]C -> 12000
A20: 17 | B20: 17 | C20: 1700 | D20: =R[-1]C[-1]+R[-1]C -> 13600
A21: 18 | B21: 18 | C21: 1800 | D21: =R[-1]C[-1]+R[-1]C -> 15300
A22: 19 | B22: 19 | C22: 1900 | D22: =R[-1]C[-1]+R[-1]C -> 17100
A23: 20 | B23: 20 | C23: 2000 | D23: =R[-1]C[-1]+R[-1]C -> 19000
A24: 21 | B24: 21 | C24: 2100 | D24: =R[-1]C[-1]+R[-1]C -> 21000
A25: 22 | B25: 22 | C25: 2200 | D25: =R[-1]C[-1]+R[-1]C -> 23100
A26: 23 | B26: 23 | C26: 2300 | D26: =R[-1]C[-1]+R[-1]C -> 25300
A27: 24 | B27: 24 | C27: 2400 | D27: =R[-1]C[-1]+R[-1]C -> 27600
A28: 25 | B28: 25 | C28: 0 | D28: =R[-1]C[-1]+R[-1]C -> 30000